Publication Date	Time	Author	Title	URL	Text
2023-08-09	20:20:51+00:00	Sam Drysdale | State House News Service	Leadership hails budget’s ‘huge transformative step’ for education	https://www.lowellsun.com/2023/08/09/leadership-hails-budgets-huge-transformative-step-for-education/	BOSTON — Described as wins by education advocates across the state, all public school students will have access to free breakfast and lunch, and undocumented immigrants who went to high school in Massachusetts can now qualify for lower in-state tuition rates. Just weeks before the school year starts, Gov. Maura Healey signed the fiscal 2024 budget Wednesday, including the two popular education policies as well as a commitment to provide last-dollar funding for residents ages 25 and older to attend community college for free. The budget dedicates $172 million to the universal school meals program, making Massachusetts the eighth state in the country to make the free meals program permanent after the policy began in the pandemic with federal money. Of the $172 million price tag, $69 million is coming out of a new $1 billion pot of money available for the first time this year after voters in November passed a new 4% surtax on annual household income above $1 million. “I know the stress of being in the classroom seeing kids come in from the projects hungry, falling asleep at their desk because they haven’t eaten since lunch the day before,” House Speaker Ron Mariano, who was a teacher in Quincy before joining the Legislature and pushed for the policy’s inclusion in the budget, said at the budget signing Wednesday. “What we have done is taken a huge transformative step in this country to do away with hunger within our children.” Though there was broad agreement among representatives to continue to offer free meals through the budget, the Senate and Healey originally suggested extending the program for another year in a standalone bill rather than as part of the state’s annual spending. But both the governor and Senate president on Wednesday celebrated the program’s inclusion in the annual state spending plan. “Universal school meals will be available to our children so their bellies won’t be grumbling in their schools while they’re trying to get work done. That will also save families approximately $1,200 per student per year so that they can spend that money on other things for their students,” Senate President Karen Spilka said. As of June 2023, an estimated 26% of households in Massachusetts with children were facing food insecurity, according to Project Bread. Healey called the program an “investment in childhood nutrition.” The Senate also got one of its priorities into law via the budget — students without legal immigration status will qualify for in-state tuition rates and state financial aid at public colleges or universities in Massachusetts if they have attended a high school in the state for at least three years or obtained their GED here. “We give every student who wants to go to college an opportunity without worrying about excessive costs or immigration status,” Spilka said. Neither House Democrats nor Healey included the measure in their own budget bills, though the House voted last week to advance a version of the budget that included the policy. In-state students will pay $17,357 in tuition to attend the University of Massachusetts’ flagship campus in Amherst this year, while their classmates who aren’t from Massachusetts will pay $39,293, according to the university. Worcester State University said it will charge $10,786 for Massachusetts undergraduates and $16,866 for out-of-state undergraduates. And at Bunker Hill Community College, the cost of four credits is $920 for in-state students and $1,744 for out-of-state students, the school said. The shift in status to “in-state students” also means more aid for undocumented immigrants. As government aid has struggled to keep pace with demand and tuition increases, UMass-generated financial aid has grown to represent 69% of free aid available for students — $395 million in fiscal 2023. Of the university-generated aid, 81% goes to in-state students. “A new generation of Massachusetts students is now one step closer to achieving the American dream,” said Elizabeth Sweet, executive director of the Massachusetts Immigrant and Refugee Advocacy Coalition. “Tuition equity will make college more affordable for all eligible immigrants, regardless of immigration status, and empower the workforce of the future. Expanding eligibility of in-state tuition rates to all residents will prove a huge benefit to the state, as the Commonwealth is currently grappling with declining college enrollment and a dwindling workforce. Tuition equity will help solve the problem and keep Massachusetts competitive.” Wednesday’s budget signing makes Massachusetts the 24th state to offer the lower, in-state tuition rate for those without legal immigration status. In a 2019 analysis of Census data, the Migration Policy Institute estimated Massachusetts had about 15,000 residents without legal immigration status between the ages of 3 and 17 and another 31,000 between the ages of 18 and 24. Senate Ways and Means Committee Chair Michael Rodrigues said in May that he does not believe the measure would generate any substantial cost for the state and would instead steer new revenue toward campuses by attracting more students who might currently be daunted by the higher out-of-state tuition costs. “The reports I’ve seen [are] actually income generated. We know that enrollment at our community colleges has declined precipitously, especially since the pandemic. Enrollment in all higher ed has declined. So this will provide increased enrollment at our higher education institutes,” he said. “Schools would see a net gain in revenue because more students would attend with in-state tuition rates.” By signing the budget, Healey also fulfills one of her campaign promises. Students 25 and older can now attend community college with a commitment from the state that it will pay whatever financial aid doesn’t cover for tuition and books. Healey, who pitched the program while campaigning last year, said the so-called MassReconnect program could reach 1.8 million Bay Staters who are eligible to receive state aid as they earn a college degree or certificate. The budget also includes a Senate-backed initiative to offer free community college for all nursing students in the state amidst a “dire need for nurses,” Spilka said.
2023-10-05	16:17:49+00:00		EXCLUSIVE: GOP Rep. Ken Buck Introduces Legislation To Target Federally Funded Healthcare For Illegal Immigrants	https://dailycaller.com/2023/10/05/colorado-ken-buck-introduces-legislation-target-federally-funded-healthcare-illegal-immigrants/	Colorado Republican Rep. Ken Buck introduced legislation to bar federal funds from being allocated toward healthcare for illegal immigrants, according to a press release exclusively obtained by the Daily Caller News Foundation. The No Federal Tax Dollars for Illegal Aliens Health Insurance Act seeks to amend the Affordable Care Act to clarify that federal funds may not be used to offset health insurance premiums or provide other benefits to non-citizens and those not legally in the U.S. Along with Buck, Colorado GOP Rep. Lauren Boebert co-sponsored the legislation that is aimed at the Department of Health and Human Services (HHS) and the U.S. Department of Treasury, according to the press release. “Tax payer dollars should not fund healthcare for non-citizens. Yet Democrats are stealthily using Section 1332 waivers to grant free healthcare to illegal immigrants,” Buck said in a statement. “This is a slap in the face to the hardworking Americans who subsidize this coverage with their tax dollars while foregoing medical care themselves. This bill ensures the needs of the American people come first, not last.” HHS and the Treasury Department approved of Colorado’s State Innovation Waiver Amendment under Section 1332 of the Affordable Care Act in June of last year, which Buck’s legislation directly targets for enabling taxpayer dollars to fund healthcare for illegal immigrants, according to the press release. (RELATED: EXCLUSIVE: Republicans Propose Banning States From Funding Health Insurance For Illegal Immigrants) “No amounts paid to a State under this paragraph may be used to offset the cost of health insurance coverage (including through premium or cost sharing reductions) or to provide any other benefit with respect to an individual who is not a citizen or national of the United States or an alien lawfully present in the United States,” the bill reads. Along with prohibiting taxpayer dollars from funding illegal immigrants, the legislation also requests that any waivers granted prior to the pending approval of the bill should be rescinded, according to the text. “I am proud to be co-sponsoring the No Federal Tax Dollars for Illegal Aliens Health Insurance bill, an initiative that I am championing alongside my fellow Coloradan, Congressman Ken Buck,” Boebert said in a statement. “It is my strong belief that taxpayer dollars should be directed towards the well-being of our citizens and legal residents, and as such, they should not be allocated to provide medical insurance for those who are in our country illegally.” Neither HHS nor the Treasure Department immediately responded to the DCNF’s requests for comment. All content created by the Daily Caller News Foundation, an independent and nonpartisan newswire service, is available without charge to any legitimate news publisher that can provide a large audience. All republished articles must include our logo, our reporter’s byline and their DCNF affiliation. For any questions about our guidelines or partnering with us, please contact licensing@dailycallernewsfoundation.org.
2023-09-16	00:51:17+00:00	https://www.sandiegouniontribune.com/people/david-l-coddon	Playwright and comic Alaudin Ullah bring solo play 'Dishwasher Dreams' to the Old Globe	https://www.sandiegouniontribune.com/entertainment/theater/story/2023-09-15/comedian-filmmaker-alaudin-ullah-bring-solo-play-dishwasher-dreams-to-the-old-globe	A onetime standup comic seen on Comedy Central, HBO and MTV, theater artist Alaudin Ullah considers himself “the guy least likely to be advocating for Muslims like me.” But he’s calling on his comedy roots to do just that in his solo performance piece “Dishwasher Dreams” at the Old Globe. “When I make fun of people’s perceptions of Muslims and the microaggressions, that’s the beauty of comedy,” said Ullah, whose 90-minute show is now in previews at the Globe’s Sheryl and Harvey White Theatre. “When someone makes you laugh, it automatically changes the state of your brain.” Ullah, who says that “Growing up Muslim is the Marines of religions,” asserts that “Muslims have a sense of humor like no one else.” His autobiographical show is also a tribute to his Bangladesh-born parents and an evocation of the immigrant experience. Portraying multiple characters in the autobiographical play, Ullah’s recollections span life in his home country through the years in Spanish Harlem when he fell in love with standup (“I’m like the baby of George Carlin and Richard Pryor,” he says) to his L.A. years that found him disillusioned with the portrayals of Muslims in film and on television. Currently the playwright-in-residence at the Public Theater in New York, Ullah said that just as seeing and meeting Carlin changed his life and propelled him into standup, seeing Ruben Santiago-Hudson’s one-person play “Lackawanna Blues” led him in another direction. “I felt theater was pulling me in,” he said. “I was hooked, I was like a junkie. I wanted to be a part of it.” Castillo Theatre in New York staged the world premiere of “Dishwasher Dreams” five years ago. Its West Coast premiere at the Old Globe is being directed by Chay Yew, longtime artistic director at the Victory Gardens Theatre in Chicago. He famously directed Lauren Yee’s “Cambodian Rock Band” at Costa Mesa’s South Coast Rep in 2018 and again a year later at La Jolla Playhouse. Yew has directed more than two dozen solo shows. “I’ve always loved them,” Yew said of solo shows, “because they’re the purest political theater. You’re actually speaking to the audience, pulling out your beating heart and presenting it to an audience every night.” When working with Ullah on “Dishwasher Dreams,” Yew recalled going “a little deeper with him and asking hard questions, like about his complex relationship with his mother and father. Going deeper was immensely important. The best kind of solo shows are painful to watch and are acts of courage. It’s a form of testimonial.” In “Dishwasher Dreams,” Ullah’s observations and characterizations are accompanied by original live music performed by Avirodh Sharma on tabla. A drummer himself who studied with Charlie Christian while living in Harlem, Ullah said he was inspired to incorporate musical accompaniment in his own show by “Lackawanna Blues,” which featured onstage acoustic guitar. “I was like ‘Oh my God, he’s playing Delta blues to monologues. How was this possible?’” Ullah said. Yew said the percussion onstage “gives you a feel of Bangladesh, yet it’s so rhythmic you sometimes forget it’s South Asian. It propels moments. It propels scenes. It’s not melodic enough that it manipulates your emotions.” For Ullah, “Dishwasher Dreams” is about bridging two existences. “Barry (Edelstein, the Old Globe’s artistic director) said when you watch it you forget that I’m Bengali. Actually, I’m about as Bengali as Pee-Wee Herman. I was there at the birth of hip-hop and punk rock. At the same time I had my mom doing the prayers. I was marinating these two worlds. “I feel that way about my career and my life: I’m a quintessential American. I just happen to have parents who are Bangladeshi. When you see me perform, I’m as American as anyone who’s out there.” When: Now in previews through Sept. 20. Opens Sept. 21 and runs through Oct. 15. Showtimes, 7 p.m. Tuesdays and Wednesdays; 8 p.m. Thursdays and Fridays; 2 and 8 p.m. Saturdays; 2 and 7 p.m. Sundays Where: Sheryl & Harvey White Theatre, The Old Globe, 1363 Old Globe Way, San Diego Online: theoldglobe.org Coddon is a freelance writer.
2023-09-24	19:34:08+00:00	Steven Oxman - For the Sun-Times	‘Sanctuary City’ review: Steppenwolf play offers thoughtful perspective on the complex lives of ‘Dreamers’	https://chicago.suntimes.com/2023/9/24/23888025/sanctuary-city-review-steppenwolf-theatre-martyna-majok-grant-kennedy-lewis-jocelyn-zamudio	At the outset of “Sanctuary City,” Jocelyn Zamudio and Grant Kennedy Lewis are playing teenagers in Newark, New Jersey. The play “Sanctuary City” is set in or near Newark, New Jersey, in the early 2000s, not long after 9/11. It focuses on two young people — 17 years old when the play starts, 21 when it ends. They don’t have names but are listed as just B for Boy (Grant Kennedy Lewis) and G for Girl (Jocelyn Zamudio). This choice may well have to do with the fact that they are both immigrants brought to America as kids, but their countries of origin are never made explicit. Names could set expectations for casting or require cultural specifics that playwright Martyna Majok is less interested in than the more universal experiences of what we’d now call “Dreamers,” not quite at home in their home. Despite being nameless, they are most certainly fully fleshed-out and convincing, the type of characters it’s easy to care about deeply. Lewis and Zamudio, both Chicago-based actors making a significant splash on one of the city’s main stages, capture the characters’ empathy, smarts, ambition and wit, while also exposing their vulnerabilities. They are teenagers after all — their nerves are naturally frayed — but they really do deal with more than their peers. B’s mother, with a long-expired visa, can’t report the abuses she experiences at work for fear of discovery. The same with G’s mother, whose husband or boyfriend abuses both her and G. When: Through Nov. 18 Where: Steppenwolf Theatre, 1646 N. Halsted Info: steppenwolf.org It’s that abuse that causes G to show up at B’s home late one night, knocking loudly on his fire escape window, asking for a place to keep warm. It’s a scene that will repeat itself often. Majok, a University of Chicago grad who won the Pulitzer Prize for drama in 2018 for her play “Cost of Living,” writes these early scenes with incredible precision, in staccato-style quick scenes that don’t proceed linearly but that couldn’t be clearer. Under Steph Paul’s direction, the playing in Steppenwolf’s in-the-round space is spare and quickly paced. At the start, Yeaji Kim’s set is nearly empty, the scenes shifting thanks to the evocative and exacting lighting design from Reza Behjat, and the physical, often angular re-positioning of the actors as they repeat many of the same lines, reflecting similar events over time. Over and over we hear “Thank you” or “I owe you” followed by “It’s OK.” The sanctuary of the title is far more about their relationship than about Newark immigration policy. So when one character’s status changes, meaning almost literally that the person’s “real” American life can now start — college, with a scholarship — the other is left behind. The only solution is marriage, but despite how incredibly close they are, their relationship has never developed in that direction. It’s fair to wonder why. The first half of “Sanctuary City” is just stunningly beautiful and one of the more emotionally immersive experiences I’ve had at a play in a long time — perhaps since Sarah DeLappe’s “The Wolves” and Annie Baker’s “The Flick,” by two writers who share with Majok a style that some have called hyper-real even though they have individual and unique voices and approaches. I’m not as enamored of the second half of the 95-minute “Sanctuary City,” although I deeply admire the artistic choices and craftsmanship. After one character goes away to college in Boston, we jump forward three years or so. B and G are now closer to adulthood and confront the complications that come with thinking further into the future. Sacrifices they were once willing to make for each other start to have tangible possible consequences. Their bond could never stay as impenetrable as it was, and Majok introduces a third character named Henry (Brandon Rivera) to bring that home. The style of the play also changes: Furniture appears, and we get one long, realistic scene, more traditional, and more — if you will — American in style. With that come more explicit discussions of the politics that so impact these characters’ lives, and the necessary contrivances that come from conflating significant confrontations into one moment in time. We start to feel the authorial control. But the writing remains deeply thoughtful, unsentimental, complex, and Zamudio in particular exquisitely portrays the transition from a teenager to a grown-up and the emotional pain of the unsaid she experienced but carefully suppressed. She forces us to ask: What is the line between admirable selflessness and self-denial? Even with some weaknesses, this play does what the best theater can: provide us with a new perspective that is likely to linger. And that makes me want to see everything Martyna Majok has written and will write into the future.
2023-10-06	15:51:13+00:00		Pakistan says its planned deportation of 1.7 million Afghan migrants will be 'phased and orderly'	https://www.sandiegouniontribune.com/news/nation-world/story/2023-10-06/pakistan-says-its-planned-deportation-of-1-7-million-afghan-migrants-will-be-phased-and-orderly	Pakistan will carry out its recently announced plans to deport all migrants who are in the country illegally, including 1.7 million Afghans, in a “phased and orderly manner,” the foreign ministry said Friday. The statement is likely meant to assuage international concerns and calm fears among Afghan refugees in Pakistan after Islamabad unexpectedly said Tuesday that all migrants — including the Afghans — without valid documentation will have to go back to their countries voluntarily before Oct. 31 to avoid mass arrests and forced deportation. This sent a wave of panic among those living in this Islamic country without papers and drew widespread condemnation from rights groups. Activists say any forced deportation of Afghans will put them at a grave risk. Mumtaz Zahra Baloch, the spokesperson for Pakistan’s Ministry of Foreign Affairs, said Friday the new policy is not aimed at Afghans only. “We have been hosting Afghans refugees generously for the past four decades” when millions of them fled Afghanistan during the 1979-1989 Soviet occupation, she said. Those 1.4 million Afghan nationals who are registered as refugees in Pakistan need not worry, she added. “Our policy is only about ... individuals who are here illegally, no matter what their nationality is,” she added. “But, unfortunately there has been a misunderstanding or misrepresentation and for some reason people have starting associating this with Afghan refugees.” “The laws in Pakistan are similar to laws in many other countries,” Baloch said. Amnesty International on Thursday asked Pakistan to allow the Afghans to continue to live in the country while the day before, U.N. Secretary-General Antonio Guterres’ spokesman expressed concerns about the new policy. “As a matter of principle it is critical that no refugees be sent back without it being a voluntary and dignified return,” U.N. spokesman Stephane Dujarric told reporters at U.N. headquarters in New York on Wednesday. In Kabul, the Taliban government’s chief spokesman, Zabihullah Mujahid, has also criticized Pakistan’s announcement, saying it was “unacceptable” and that Islamabad should reconsider the decision. Although Pakistani security forces and police have routinely been arresting and deporting Afghans who have sneaked into the country without valid documents in recent years, this is the first time that the government has announced plans for such a major crackdown. The developments come amid a spike in attacks by the Pakistani Taliban, who have hideouts and bases in Afghanistan but regularly cross into Pakistan to stage attacks on Pakistani forces. The outlawed Pakistani Taliban, known as Tehrik-e-Taliban Pakistan or TTP, often claim attacks on Pakistani security forces. But they have distanced themselves from a pair of suicide bombings last week that killed 59 people in southwest and northwest areas bordering Afghanistan. Nobody has claimed responsibility for those attacks. Baloch said some of the migrants without papers, including Afghans, have already started going back to their countries. “We are allowing a grace period until” the end of the month, she said. Pakistan has long demanded that the Taliban authorities in Afghanistan cease their support for the TTP. The Pakistani Taliban are a separate group but are allied with the Afghan Taliban, who seized control of Afghanistan in mid-August 2021 as U.S. and NATO forces were in the last weeks of their withdrawal from the country, after 20 years of war. The takeover has emboldened the TTP. Baloch also said that Pakistan’s Foreign Minister Jalil Abbas Jilani held talks in China, where he is currently on an official visit, with Afghanistan’s Taliban-appointed Foreign Minister Amir Khan Muttaqi. “Their meeting was very productive, she said without elaborating and urged the Afghan Taliban to disarm the TTP so that the Afghan territory would no longer be a launching pad for attacks in Pakistan. She, however, insisted that the planned crackdown on migrants who are in Pakistan without proper authorization was not aimed at bargaining with the Afghan Taliban authorities. “Absolutely, this is not the case all ... we only want all illegal migrants to go back,” she said. 
