Publication Date	Time	Author	Title	URL	Text
2023-09-22	20:37:27+00:00	City News Service | news@socalnews.com	The 15th bus of migrants from Texas arrives in Los Angeles	https://www.dailybreeze.com/2023/09/22/the-15th-bus-of-migrants-from-texas-arrives-in-los-angeles/	Another bus carrying migrants from Texas arrived in downtown Los Angeles on Friday, Sept. 22, the 15th such arrival since June. “One bus with migrants on board from Texas arrived around 9:35 a.m today at Union Station,” Zach Seidl, deputy mayor of communications for Mayor Karen Bass, said in a statement. “This is the fifteenth bus that has arrived. The city has continued to work with city departments, the county and a coalition of nonprofit organizations, in addition to our faith partners, to execute a plan set in place earlier this year. As we have before, when we became aware of the bus yesterday, we activated our plan,” Seidl said. On X, formerly known as Twitter, the Coalition for Humane Immigrant Rights (CHIRLA) confirmed the arrival of the bus with 45 asylum seekers from Texas. There were 13 families on board, including 23 children from Colombia, Mexico, Peru and Venezuela. CHIRLA is a member of the L.A. Welcomes Collective, a network of nonprofit, faith groups and city and county services that respond to the arrival of migrant buses. “There is no crisis of compassion in Los Angeles. There is plenty of sympathy and kindness in the largest, most diverse state in the U.S. Our limited resources will support those who need us and they in turn make our communities safe, vital and strong,” CHIRLA said in a statement. Texas Gov. Greg Abbott has been orchestrating the trips under Operation Lone Star, saying Texas’ border region is “overwhelmed” by immigrants crossing the Mexican border. OLS is a joint operation between the Texas Department of Public Safety and the Texas Military Department along the southern border between Texas and Mexico. Abbott added, “Texas secures the border in Pres. (Joe) Biden’s absence.” “Texas’ small border towns remain overwhelmed and overrun by the thousands of people illegally crossing into Texas from Mexico because of President Biden’s refusal to secure the border,” Abbott said in a statement after the first bus arrived in Los Angeles in June. “Los Angeles is a major city that migrants seek to go to, particularly now that its city leaders approved its self-declared sanctuary city status. Our border communities are on the front lines of President Biden’s border crisis, and Texas will continue providing this much-needed relief until he steps up to do his job and secure the border,” he added. Mayor Karen Bass has complained that Abbott’s office does not share enough information with Los Angeles about the arrivals. She told KNX that if Abbott’s concerns and actions were legitimate and sincere, then “someone in the government and Texas would notify us and coordinate with us.” “We hear about the buses headed our way when they’re on the way. We have no idea who’s going to be on the bus, how many people it is or what condition they’re going to be in when they get here,” she said. “Sometimes they haven’t had any food, barely had enough water.” The Los Angeles City Council approved a motion on June 9 seeking to formally establish the city as a sanctuary city. Last month, the council approved a motion calling for the City Attorney’s Office to investigate whether crimes were committed on or before June 14, when Abbott sent 42 migrants to Los Angeles in the first of the arrivals.
2023-10-06	12:06:16+00:00		Most states have seen increase in illegal immigration 'encounters'	https://www.upi.com/Top_News/US/2023/10/06/immigration-surge-border-texas-denver-new-york/3071696532676/	"Oct. 6 (UPI) -- ""Every state is now a border state."" That is the claim that Republicans have made in response to immigration enforcement under the administration of President Joe Biden. It was repeated again by Sen. Tim Scott, R-S.C., on the primary debate stage at the Ronald Reagan Presidential Library in Simi Valley, Calif., last week. While the statement is not literal, data from the U.S. Customs and Border Protection shows that the increase in illegal immigration is touching states beyond the southern border. The politics around immigration have taken the blame for the increase, but the agency says it is driven by transnational criminal organizations such as the drug cartels. ""CBP remains vigilant in the face of ruthless smugglers and transnational criminal organizations who exploit vulnerable migrants, the same criminal organizations trafficking in lethal drugs that harm our communities,"" Troy Miller, senior official performing the duties of the commissioner, said in a statement. The agency reports 2.86 million encounters with migrants between ports of entry since last October. The data is compiled year-to-year from October through September. For the year ending in September 2022, there were 2.76 million encounters. There were about 1.95 million in 2021 and 648,822 in 2020. There were 304,162 encounters in August, up from 245,213 in July. It was the highest single month total in the last four years, which is as far back as the data shared by the agency goes. These figures do not include ""got aways,"" meaning people who illegally crossed the border but were not directly encountered by border agents. The concern when Title 42 came to an end in May was that it would inspire a heavy surge of illegal immigration. Yet there were more encounters in April (276,055) and May (275,188) than in June (211,514) or July (245,213). The average per month in June through August is 256,629, which is 6,803 more than the average of the last three months when Title 42 was fully in effect. New York is one of the northernmost states to experience an influx of people who have immigrated to the United States illegally. Gov. Kathy Hochul has requested assistance from the president. Her requests include expedited work authorization for asylum seekers, financial assistance and reimbursement for the use of the state's National Guard. There has been a 32% increase in encounters in New York this year with one month still left to be recorded. The total to date is more than 118,000. ""We have been responding to this humanitarian crisis for more than a year now, and in recent days we are seeing a significant surge in arrivals,"" said Anne Williams-Isom, deputy mayor for Health and Human Services in New York City. ""It is a very frustrating moment for all New Yorkers. We have called on the federal government to provide additional support in the form of financial assistance, allowing work authorization for more asylum seekers, a coordinated decompression strategy -- and declaring this a federal emergency."" Neighboring New Jersey, home of presidential candidate and former Republican Gov. Chris Christie, is one of the few states that has not surpassed its number of 2022 encounters. The state recorded 14,735 in 2022 and 12,197 this year. South Carolina, home state to two candidates, former Gov. Nikki Haley and Scott, has also not surpassed its 2022 numbers. It recorded 3,140 encounters in 2022 and 2,443 so far this year. Most states, however, have seen an uptick, even though they are hundreds of miles from the Mexico border. Encounters in Minnesota are up 48% to 2,354. Colorado's encounters have nearly doubled, up from 954 to 1,796. Jon Ewing, spokesman for Denver Human Services, told UPI his city has experienced three influxes of immigrants in the past year. However, like in most cases, it is difficult to distinguish how many of the immigrants have come to the country illegally. The first surge happened in December, followed by another in May and one that is ongoing. Ewing said many of the immigrants are coming from Venezuela. ""We've seen an incredible increase in individuals coming here from the southern border,"" Ewing said. ""These are individuals seeking help and asylum. Many are fleeing from violence."" If an individual arrives in Denver, they can stay in a shelter for 14 days. If they are with a family, they have 37 days. Ewing and his team provide them with resources to find work and shelter beyond that. In some cases, they are offered bus tickets if they have friends or family somewhere else. ""The resources are limited. It's a struggle all the way across the board,"" Ewing said. Although resources are stretched thin in Denver, the intake process remains orderly, he said. The city's reception center looks much like the Department of Motor Vehicles on most days. Most people know how the process works and what to expect when they arrive. Many even find work very quickly. Texas Gov. Greg Abbott has added to surges in cities like Denver by busing immigrants from his state. On Thursday, Abbott said in a statement on social media that he has sent 3,100 people to Denver, as well as 18,200 to New York City, 13,000 to Chicago and 12,500 to Washington. Hours before Abbott's statement, the Biden administration announced it had reversed direction on the construction of a wall at the southern border. The administration will waive 26 federal laws, including environmental protection and laws protecting Indigenous land, in order to construct a physical barrier in Texas. Expulsions, admissions and deportations are just a few of the functions of U.S. Customs and Border Patrol. The agency also takes on search-and-rescue efforts. Migrants are rescued from the deserts of the Southwest or from the waters of the Rio Grande for instance. There have been 32,577 search-and-rescue instances by the Southwest Border Patrol alone, a 33% increase. Expulsions and deportations are being carried out under the Title 8 immigration law. It carries notable differences from Title 42. The chief difference is that Title 8 takes formal measures to ban migrants from attempting to re-enter the United States for at least five years. If they attempt to re-enter before then, they face potential criminal charges and jail time. Title 42 carries no such measures, meaning a migrant may attempt to return to the United States almost immediately after being processed. CBP says recidivism has decreased significantly since the end of Title 42. Of the 232,972 encounters recorded in August, 11% had made a previous attempt to enter the United States in the last 12 months. In April, the last full month that Title 42 was enforced, nearly a quarter of all encounters were made with people who had previous attempts in the last 12 months."
2023-08-29	19:38:25+00:00		‘How Is It Possible?’: Doocy Presses KJP On Report Of ISIS Sympathizer Smuggling Illegal Immigrants Into US	https://dailycaller.com/2023/08/29/doocy-kjp-isis-sympathizer-illegal-immigrants-border/	Fox News White House correspondent Peter Doocy pressed White House press secretary Karine Jean-Pierre on Tuesday about reports of an ISIS sympathizer smuggling illegal migrants into the United States. The FBI is investigating more than a dozen Uzbek nationals who allegedly traveled across the U.S.-Mexico border with the help of the ISIS-sympathizing smuggler, CNN reported Tuesday. Officials said there is no specific ISIS plot but are currently trying to assess all of the migrants the smuggler helped to the U.S. illegally. “How is it possible that an ISIS sympathizer is sneaking people into this country?” Doocy asked. “The intelligence alerted us to a human smuggling network. We moved fast and successfully to disrupt it. So I just want to be very clear of that we are moving—” she began. “You say you disrupted it. Are you saying you know where all of the people this ISIS sympathizer snuck into the country are?” Doocy asked. “If I can answer the question, I’m sure I’ll touch on everything you want to ask me,” Jean-Pierre said. (RELATED: ‘That’s Exactly What’s Happening!’: Doocy, Jean-Pierre Spar Over CDC Guidance For Illegal Immigrants Versus All Other Travelers) The press secretary told Doocy that the law enforcement “disrupted” the smuggling operation and has detained the smuggler in question and that immigration authorities have placed migrants who entered the country with help from the alleged ISIS sympathizer into an expedited removal process. She also claimed there is no sign that the smuggling operation had any ties to ISIS. Doocy paraphrased a famous quote, noting that the U.S. has to be right about potential terrorist attacks in every instance, while the terrorists only have to be right once. Jean-Pierre assured the White House is “committed” to protecting the nation against terrorism. Doocy further pressed Jean-Pierre about the administration’s “sudden urgency” to combat the smuggling operation. “We’ve seen human smuggling networks operated by the cartels for years, why the sudden urgency with this one?” Doocy asked. “We always have, we always have and will be vigilant here when it comes to making sure that we are protecting our homeland. That is something that this president is committed to, something that this administration is committed to,” Jean-Pierre responded. “We will always be and will continue to be. Let’s not forget that this was successfully disrupted and it was because of the quick act of our law enforcement that we are incredibly grateful to.” When FBI agents learned of the smuggling operations, officials immediately rushed to locate the migrants and arrested the smuggler and other members of the operation, CNN reported. The smuggler is not believed to be a member of the terrorist organization, nor do officials suspect that he was smuggling migrants on behalf of ISIS. The U.S. has not yet located all of the migrants who entered the country with the help of the alleged smuggler, and the more than 15 who are in custody are still being investigated by the FBI as possible criminal threats, CNN reported.
2023-08-24	06:47:26+00:00		Chelsea and PAIR Project Partner on New Immigration Legal Services Program	http://chelsearecord.com/2023/08/24/chelsea-and-pair-project-partner-on-new-immigration-legal-services-program/	The City’s Department of Housing and Community Development is launching a new program in partnership with the Political Asylum/Immigration Representation (PAIR) Project, to provide high-quality immigration focused legal services to low-income Chelsea residents. Funding to operate the first two years of the program is being provided through the American Rescue Plan Act (ARPA) community fund. ARPA funding will support two full-time staff positions who will provide full representation to 60 Chelsea residents per year, serving 100 residents yearly with free legal consultations, referrals, and support accessing wrap-around services. The program will reduce barriers to low-income residents facing complex immigration procedures and needing assistance with tasks such as changing their address, requesting copies of their records, or fulfilling reporting requirements. Community education opportunities will also be integrated in the form of know-your-rights trainings. “PAIR is honored to be a recipient of this generous community fund and to work as a partner with the City of Chelsea and other Chelsea-based service providers to protect the legal rights of immigrants residing in Chelsea,” said Anita P. Sharma, PAIR’s Executive Director. “The funds bring profound and transformative support to PAIR, allowing PAIR to expand its staff and grow its Justice for Immigrant Families Program.” The new program aims to address a shortage of pro bono legal services for immigrants, coupled with debilitating financial barriers residents face to obtaining private representation. Pro bono programs in the region are largely at capacity, with many organizations having accumulated years-long waitlists. In the absence of quality, affordable representation, immigrant families are often forced to pay thousands of dollars or take on predatory loans to obtain legal representation, apply for work permits, and maintain lawful status. Moreover, residents seeking to exercise their legal right to humanitarian relief are frequently subject to scams and misinformation, further undermining their economic stability and wellbeing. These economic barriers were exacerbated by the COVID-19 pandemic. Despite making up a large percentage of the frontline and essential workforce, immigrant families were oftentimes ineligible for COVID-19 relief programs or lacked access to programs and services because of language barriers, and the legitimate fear of taking part in public assistance. Chelsea is a proud Sanctuary City with a decades-long legacy of welcoming and becoming home to successive waves of immigrants. By investing ARPA dollars in services for immigrant residents, the Department aims to support the local recovery, economic stability, and long-term unity of immigrant Chelsea families. The PAIR Project, a Boston-based organization, has a long standing history of providing legal services in Chelsea and partnering with local organizations and City departments. The ARPA Immigration Legal Services Program will continue this commitment to collaboration, working closely with stakeholders who provide housing assistance, food resources, mental health services, and other wraparound services to Chelsea’s diverse immigrant community. Residents wishing to access immigration legal services through the new program can contact the PAIR Project by calling (617) 742-9296 Ext. 5 or by filling out a basic intake form at https://qr1.be/CKW5. Residents may also stop by the Department of Housing and Community Development Office at Chelsea City Hall, Room 101, during City Hall business hours. Additional information on drop-in legal consultation clinics and workshops will be publicized on an ongoing basis.
2023-10-12	20:15:57+00:00		Biden Admin Threatens Banks That Refuse To Lend Money To Illegal Immigrants	https://dailycaller.com/2023/10/12/biden-admin-threatens-banks-refuse-lend-money-illegal-immigrants/	The Biden administration released a statement Thursday warning financial institutions against using a person’s immigration status in credit applications. The Consumer Financial Protection Bureau (CFPB) and the Department of Justice (DOJ) released a joint statement telling financial institutions that while it is not illegal to consider a person’s immigration status in the decision on whether to lend money, an overreliance on it could run afoul of the law, according to the statement. The statement implicates the Equal Credit Opportunity Act (ECOA), which makes it illegal to discriminate on the basis of race, color, religion, national origin, sex and more in considering a person’s credit application as the mechanism, even though the law does not list citizenship status as a protected attribute. (RELATED: New Mexico Will Allow Illegal Migrants To Obtain Law Licenses) “Fair access to credit is crucially important for building wealth and strengthening household financial stability,” Rohit Chopra, CFPB director, said in a press release. “The CFPB will not allow companies to use immigration status as an excuse for illegal discrimination.” The CFPB notes that the reason for the guidance comes after the agency received a number of instances of consumers being rejected in their applications for credit cards and auto, student, personal and equipment loans on the basis of their noncitizen status despite having a good credit history and a tie to the United States, according to the press release. The CFPB and @TheJusticeDept today issued a joint statement that reminds financial institutions that all credit applicants are protected from illegal discrimination, regardless of their immigration status. https://t.co/L7cVVazP1m — consumerfinance.gov (@CFPB) October 12, 2023 “Lenders should not deny people the opportunity to take out a loan to buy a home, build their businesses or otherwise pursue their financial goals because of unlawful bias and without regard to their actual ability to repay,” Kristen Clarke, assistant attorney general of the DOJ’s Civil Rights Division, said in the press release. “This guidance reminds lenders that denying someone access to credit based solely on their actual or perceived immigrant status may violate federal law.” The two agencies acknowledge that while the ECOA permits creditors to consider someone’s citizenship status, the act of doing so may violate prohibitions on the consideration of other factors like national origin or race, according to the press release. The regulators emphasize that there is no “safe harbor” when considering an applicant’s immigration status. DOJ did not immediately respond to a request to comment from the Daily Caller News Foundation. The CFPB deferred the DCNF to previously made statements. All content created by the Daily Caller News Foundation, an independent and nonpartisan newswire service, is available without charge to any legitimate news publisher that can provide a large audience. All republished articles must include our logo, our reporter’s byline and their DCNF affiliation. For any questions about our guidelines or partnering with us, please contact licensing@dailycallernewsfoundation.org.
2023-09-30	17:26:31+00:00	Associated Press   Sept. 30, 2023 10:26 AM PT	An Ecuadorian migrant was killed in Mexico in a crash of a van operated by the immigration agency	https://www.sandiegouniontribune.com/news/california/story/2023-09-30/an-ecuadorian-migrant-was-killed-in-mexico-in-a-crash-of-a-van-operated-by-the-immigration-agency	A migrant from Ecuador died and 10 others from Colombia and Guatemala were injured in an crash that occurred while they were being taken for processing in a van operated by Mexico’s immigration agency, authorities said Saturday. Mexico’s National Migration Institute said the van was involved in a collision with a bus in the the city of Mexicali, across the border from Calexico, California. The institute said that eight injured migrants from Colombia and two from Guatemala had been taken to hospitals for treatment. The drivers of the van and the bus involved in Friday’s crash, which happened after the migrants had been detained along the border, were also injured. The institute didn’t release the name of the 36-year-old Ecuadorian killed in the crash. A photo supplied by the agency showed the van crushed up against a utility pole. It was the latest in a series of deaths amid an upsurge in the number of migrants heading toward the U.S. border. On Friday, two Mexican migrants were fatally shot on the Mexican side of the border and three others suffered gunshot wounds, the Migration Institute said. Rescue services found a group of 14 Mexican nationals at dawn on Cuchuma Hill near Tecate, a city between Mexicali and Tijuana. The cause of the shooting wasn’t known, but migrant crossings often involve agreements with local cartels for right of passage. Migrants are sometimes shot if their smuggler is working for a rival gang or if they haven’t paid passage rights. Migrants are also often robbed by roving gangs of thieves and kidnappers in border areas. And on Thursday in the southern state of Chiapas on the border with Guatemala, a truck flipped over on the highway, killing two Central American migrants and injuring another 27. The Migration Institute said Friday that 52 migrants were traveling in an overcrowded dump truck when the driver lost control and overturned. The injured, including six children, were transported to hospital, where they were all granted legal cards of asylum, as victims of a crime on Mexican territory. On Wednesday, two Central American migrants died after trying to board a moving train in the state of Coahuila near the Texas border.
