Publication Date	Time	Author	Title	URL	Text
2023-09-19	13:30:20+00:00	https://www.latimes.com/people/david-lauter	The Times is exploring immigrant stories in America. Here's what we've learned so far	https://www.latimes.com/california/newsletter/2023-09-19/the-times-is-exploring-americas-immigrant-stories-heres-what-weve-learned-so-far-essential-california	Good morning. It’s Tuesday, Sept. 19. Here’s what you need to know to start your day. What if we could give you a window into the lives of one-sixth of the U.S. population? What would we find out? I’m David Lauter, a senior editor at The Times. That window is what we set out to create with Immigrant Dreams, our project on the lives of America’s huge and growing immigrant population, who make up 1 in 6 adults in the U.S. — close to a record for the past century. For years, immigration has been one of the hottest of political hot buttons. The U.S. has been stuck in a seemingly unending debate over a broken immigration system, featuring stalemates in Congress, disorder at the southern border and a lot of heated rhetoric. Much of that debate, however, has ignored the voices of actual immigrants. So we set out to ask immigrants to tell us about their lives and put their voices and stories at the forefront. That’s not only an important American story, it’s a crucial story for California, which is home to the nation’s largest immigrant population. We partnered with the nonprofit KFF, formerly the Kaiser Family Foundation, to do a large-scale poll of U.S. immigrants to find out how their lives are going, what they’ve experienced since coming to America and what their expectations are for their futures. Planning and conducting that poll took almost two years. We tested extensively in advance to make sure we had polling methods that would work to get a representative sample of immigrants. Then we drafted a questionnaire and translated it into nine languages. Pollsters spent more than 13,000 hours interviewing people and mailed more than 75,000 surveys. You can take some of the poll questions yourself and see how your views compare with the people we surveyed. Once the data came back this spring, Times reporters and photographers went to work looking for individuals and families with whom we could spend time to illuminate the findings of the survey. So what did we find out? Optimism. That’s one of the clearest findings and the theme of our initial story, told beautifully by reporters Brittny Mejia, Jeong Park, Jack Herrera and Tyrone Beason and photographers Irfan Khan, Dania Maxwell and Brittainy Newman. Columnist Gustavo Arellano weighed in, as well, with his own story of immigrant optimism. And because our poll told us that many immigrants feel they don’t have enough information about how the U.S. system works, our project also includes pieces about important issues like the public charge rule and how to protect yourself against scams. For the rest of the fall, we’ll be rolling out additional stories about aspects of immigrants’ lives. We hope you’ll come along with us on the journey. The killing of a L.A. County sheriff’s deputy Get unlimited access to the Los Angeles Times. Subscribe here. In an increasingly pessimistic era, immigrants espouse a hallmark American trait — optimism. Maria Del Pilar Barradas-Medel’s salary is humble, and her family of five has to squeeze into a one-bedroom mobile home in Azusa, Calif. But it’s a better life than she could have imagined back home. And it has allowed her to help her extended family in Valle de Chalco, Mexico. “I would do it again,” she said of her trek north half a lifetime ago. “Definitely.” How can we make this newsletter more useful? Send comments to essentialcalifornia@latimes.com. Show us your favorite place in California! Send us photos you have taken of spots in California that are special — natural or human-made — and tell us why they’re important to you. Today’s great photo is from Gerald Francisco of Kailua-Kona, Hawaii: Mission San Luis Rey de Francia in Oceanside, Calif. Gerald writes: When I lived in California I would visit as many Missions as I could but this one is my favorite. It is beautifully preserved and while walking around you almost feel transported in time to historic California. Have a great day, from the Essential California team Elvia Limon, multiplatform editorKevinisha Walker, multiplatform editorLaura Blasey, assistant editor Check our top stories, topics and the latest articles on latimes.com.
2023-10-05	23:16:18+00:00	https://www.latimes.com/people/tracy-wilkinson	U.S. presses for cooperation from Mexico on fentanyl, but results are mixed	https://www.latimes.com/politics/story/2023-10-05/u-s-presses-for-cooperation-from-mexico-on-fentanyl-but-results-are-mixed	Branding the scourge of fentanyl deaths the “top of the agenda,” America’s senior diplomat on Thursday implored Mexico to help stop the flow of the drug into the U.S., but it was unclear whether he received a meaningful commitment from Mexican President Andrés Manuel López Obrador. Secretary of State Antony J. Blinken, in Mexico City for a series of high-level security and economic talks, said in a news conference he had “no doubt about Mexico’s commitment to working collaboratively ... a commitment in words and deeds.” But López Obrador has been slow to acknowledge the depths of the fentanyl crisis, preferring until recently to blame U.S. consumption and not the role of Mexico in production and supply of the synthetic opiate, which is fabricated using chemicals from China. Mexican Foreign Affairs Secretary Alicia Bárcena vowed to fight the trafficking of fentanyl, focusing on controlling the precursor chemicals, while Secretary of Security and Citizen Protection Rosa Icela Rodríguez insisted that Mexico was not a producer of the drug but merely a transit point — a notion that U.S. officials say is no longer the case. Blinken outlined a detailed plan for tracing chemicals in Mexico that will recruit private companies along with government agencies to step up raids and crack down on those who produce and traffic the drugs,and level sanctions against Chinese companies that are the major source for the chemicals. “We are doing everything in our power to stop the shipment into Mexico of the precursor chemicals and pill presses and the shipment of the drug into the U.S.,” said Homeland Security Advisor Liz Sherwood-Randall, who accompanied Blinken. Blinken and López Obrador met for about an hour behind closed doors, with no access for journalists. A brief summary of the meeting provided by the State Department said the two “discussed the challenges presented by irregular migration and synthetic fentanyl and our efforts to address them.” According to the summary, Blinken thanked the Mexican president for his country’s extradition last month of Ovidio Guzmán López, a son of Joaquin “El Chapo” Guzmán, the notorious imprisoned leader of the Sinaloa cartel, considered one of Mexico’s largest producers of fentanyl. In the meeting, López Obrador spoke of the importance of open channels of communication and “this relationship of understanding and friendship” that will assist in confronting shared problems and challenges, Mexican news media reported. The two days of talks here follow similar sessions last week in Washington involving Blinken and Cabinet members from both governments. Blinken was joined in Mexico by U.S. Atty. Gen. Merrick Garland and Homeland Security Secretary Alejandro N. Mayorkas. In opening remarks, Mexican officials praised cooperation but offered no specific plans of action. “We are committed to fighting synthetic drugs that have caused so much damage to the U.S.,” Bárcena said. She urged greater investment and technological innovation for the U.S.-Mexico border that would facilitate trade but also bolster security against the trafficking of drugs headed north and weapons headed south. Mayorkas announced a new system in which the U.S. will share regular reports with Mexico on weapons believed to be destined for that country. Rodríguez said drugs and violence are part of a “vicious circle” that can be overcome only “with binational solutions … working from both sides of the border.” Blinken frequently cites this disturbing statistic: Overdoses from fentanyl, a substance often concealed in other drugs, are now the leading cause of death in U.S. adults ages 18 to 49. Moreover, use of and death from fentanyl are no longer an exclusively U.S. problem, Blinken has said. “We’ve been the canary in the coal mine,” Blinken said during an appearance at the University of Texas at Austin on Wednesday. “Now we’re seeing it spread to many other places in the world. … This is becoming a global problem.” Mexican officials cite numerous raids on illicit drug operations on national territory and destruction of laboratories — 900 this year alone — as evidence of the government’s commitment to cracking down on the fentanyl trade. However, only a tiny percentage of those operations have targeted fentanyl production, according to U.S. officials. Migration also dominated the talks, another issue for which the U.S. and Mexico have a “shared responsibility,” Blinken said. Mayorkas spoke of formulating an “effective model” for immigration. But his comments came as the Biden administration announced it was resuming limited construction of a southern border wall, which López Obrador has sharply criticized. Mayorkas said that funds for the construction were appropriated during the Trump administration and that the law requires the money be spent for that purpose. In his daily morning news conference earlier in the day, López Obrador lamented the decision. “Until now, he had been the only president who had not built a border wall,” López Obrador said of President Biden. “I understand there are strong pressures from extreme right-wing groups in the United States, especially those who want to take advantage of the migration phenomenon and drug consumption for electoral purposes.” Also in Mexico City, Binken and Mayorkas conferred with their counterparts from Colombia and Panama and reached a decision to begin deporting Venezuelan nationals who do not have a legal basis to remain in the U.S., the State Department said. Venezuela has agreed to receive the deported nationals, the department said in a statement.
2023-09-17	11:00:41+00:00	Sept. 17, 2023 4 AM PT	Immigrant Dreams: Our landmark poll surveys the lives of one-sixth of the nation	https://www.latimes.com/world-nation/story/2023-09-17/immigrant-dreams-immigration-poll-latimes-kff	The national debate over immigration has raged for decades but often ignores the lives of actual immigrants. Drawing on an unprecedented poll, this series tells the stories of immigrants in America today — roughly 1 in 6 adult Americans — portraying the diversity of immigrant experiences and putting their voices in the foreground. Immigrants to the U.S. face extensive challenges, but they still report high levels of optimism about their futures and trust in American institutions, a comprehensive survey has found. Sept. 17, 2023 Despite more than a decade of political and legal attacks, nearly 600,000 people are still receiving the benefits of the Deferred Action for Childhood Arrivals program, renewing their DACA designations in two-year increments. Sept. 21, 2023 Carrying out the KFF/L.A. Times survey of immigrants required work far beyond the normal survey, but the result provides a unique source of information about America’s immigrant population. Sept. 17, 2023 Immigrants in the U.S. report high levels of on-the-job discrimination. Among those who are likely undocumented, it’s even worse. Oct. 19, 2023 The doom and gloom that many Americans offer up on social media and in politics betrays something fundamental about this country. These days, it’s immigrants who keep hope alive. Sept. 17, 2023 We asked thousands of immigrants about their experiences and lives in this country. How would you answer those same questions? Sept. 17, 2023 Jamaica native Winsome Pendergrass is part of a surge of immigrants from Africa and the Caribbean. She supports solidarity among Black Americans, but has been shunned in return. Sept. 21, 2023 Many immigrants are confused about what benefits and aid programs they can receive without being designated a public charge. Here are the facts. For several years, Oswaldo Rafael Cabrera touted his services as an immigration attorney in advertisements, social media posts and interviews with Spanish-language news outlets. 
2023-08-17	22:36:31+00:00	Associated Press   Aug. 17, 2023 3:36 PM PT	Mexico finds 2 migrants dead in desert, looking for 2 more reported dead	https://www.sandiegouniontribune.com/news/nation-world/story/2023-08-17/mexico-finds-2-migrants-dead-in-desert-looking-for-2-more-reported-dead	Mexican immigration officials said Thursday they have found two migrants dead in the desert near the Texas border, and are looking for two more migrants that survivors said had also died. All of the migrants were Mexican citizens. The deaths occurred in the sparsely-populated northern border state of Coahuila, across from Texas. The National Immigration Institute said it had received a report from U.S. Customs and Border Protection on Tuesday saying that 12 migrants had been detained at the border. The detained migrants said that they were in a group of 16 that had been abandoned in the desert by migrant smugglers. The twelve said the other four had died, though the cause of death was unclear. Mexican authorities launched an air and land search for the migrants, and said they considered the other two “missing.” Because it is practically impossible to carry enough water to make it through the desert, deaths from dehydration and heatstroke are not infrequent. However, as described by immigration officials, the area where the bodies were found is less traveled and well outside the main smuggling routes.
2023-10-05	00:15:59+00:00		Blinken, other top officials to discuss fentanyl, trafficking, immigration with Mexican counterparts	https://www.foxnews.com/world/blinken-other-top-officials-discuss-fentanyl-trafficking-immigration-mexican-counterparts	"Fox News Flash top headlines are here. Check out what's clicking on Foxnews.com. U.S. Secretary of State Antony Blinken and other top officials from the Biden administration will visit Mexico on Wednesday to discuss shared security issues, foremost among them trafficking of the synthetic opioid fentanyl, but also arms trafficking and increasing migration. The latest round of the High-Level Security Dialogue brings together Blinken, U.S. Attorney General Merrick Garland and Homeland Security Secretary Alejandro Mayorkas, among others, with their Mexican counterparts for two days of talks. Heightened migration flows are expected to be discussed as the Biden administration comes under increasing pressure from Republicans and mayors from the president’s own party to do more to slow migrant arrivals. Blinken was scheduled to discuss migration Wednesday with Mexico's Foreign Affairs Secretary Alicia Bárcena, as well as the foreign ministers of Colombia and Panama. New York City Mayor Eric Adams was also scheduled to arrive in Mexico City Wednesday, part of a swing through Latin America aimed at learning more about asylum seekers’ paths to the U.S. Mexican Foreign Minister Alicia Barcena, left, appears alongside Secretary of State Antony Blinken, Friday, Sept. 29, 2023, in Washington. (AP Photo/Mark Schiefelbein) In August, the U.S. Border Patrol made 181,509 arrests at the Mexican border, up 37% from July but little changed from August 2022 and well below the more than 220,000 in December, according to figures released in September. On Tuesday night, hundreds of migrants arrived in the northern Mexican border city of Ciudad Juarez across the border from El Paso, Texas aboard a freight train. They clambered off the train and immediately made their way to the border where they stopped at coils of barbed wire. Elizabeth Romero, 32, left Venezuela three months earlier with her husband and 6-year-old son. She was three weeks pregnant then and spent her first trimester hiking through the jungle-clad border of Colombia and Panama and most recently spent three days aboard the freight train that brought her to the U.S.-Mexico border. She and her son, who celebrated his 6th birthday atop a freight car this week, have suffered bouts of fever. They left Venezuela because they couldn’t make ends meet financially. Her family remains there. ""We hope that the United States receives us and gives us the support that we need,"" Romero said. They planned to turn themselves into U.S. authorities at the border because they had already waited three months without receiving an appointment to request asylum through CBP One, a mobile app. The U.S. has tried to get Mexico and countries farther south to do more. In April, the U.S., Panama and Colombia announced a campaign to slow migration through the treacherous Darien Gap dividing Colombia and Panama. But migration through the jungle has only accelerated and is expected to approach some 500,000 people this year."
