Publication Date	Time	Author	Title	URL	Text
2023-08-22	00:12:57+00:00	Michael Loria	CPS disputes claim that migrant children from police station were turned away at school	https://chicago.suntimes.com/2023/8/21/23840607/cps-disputes-claim-that-migrant-children-from-police-station-were-turned-away-at-school	Eliannys Piña and her son, Elias, sit outside the Grand Crossing District police station. The sensations of the first day of school in Chicago — from excited introductions to relearning to sit still — remain a mystery for Johanderson Velasquez, a recent immigrant, because he was turned away before he got the chance. Lea este artículo en español en La Voz Chicago. The 13-year-old from Venezuela arrived Monday morning at a CPS location near where his family is staying, hoping to enroll — but instead he was told the school didn’t have enough Spanish speakers on staff to accommodate him. “I was nervous because it was just like the movies I saw about school,” Velasquez said of the hubbub outside Woodlawn’s Emmett Louis Till Math and Science Academy, about a mile away from the Grand Crossing police station where he and others were staying. The group of about 10 children was told to return to the school Tuesday or wait for a call, said Zach Goldstein, a volunteer with the Police Station Response Team, a group of several hundred people that have been helping immigrants at police stations with basic needs such as food and clothing. Goldstein accompanied several families to the school Monday. “The staff said they weren’t prepared to accept English language learners,” said Goldstein, 24. Emmett Till Academy in Chicago’s Woodlawn neighborhood. CPS disputed the allegations in a statement Monday, saying one of the families had an outdated form that stalled the process, but that officials attempted to provide updated forms. “The group then left, even as the principal and staff were attempting to help the families,” according to the statement. Goldstein disputed that account. “There was no mention of any outdated forms,” he said. “We did not leave as they were attempting to help us. I repeatedly asked if there was any way they could stay, and they told us to leave.” The Woodlawn school is 96% Black, less than 3% Hispanic and has no English learners, according to CPS data. The accusation comes about a week after CPS officials had told reporters that minors staying at police stations would have help enrolling in nearby schools. “I felt a little bad about it because the kids are the main reason we’re here,” said Eliannys Piña, a mother of 9-year-old Elias and 6-year-old Susej, who were both turned away as well. “Education is something that they need,” Piña said. About 1,000 immigrants remain in police stations as of last Tuesday, according to the Office of Emergency Management and Communications, including some 400 minors. CPS said Chicago Teachers Union volunteers would help enroll children at police stations for school, but Britt Hodgdon, a lead volunteer at the Grand Crossing station, said that hasn’t happened there. “Summer has come and gone and we’ve received zero outreach,” Hodgdon said. Hodgdon said families have been staying at the station since March and during the last school year, CPS didn’t have the students enroll in schools then, either. Migrants sit outside the Grand Crossing District police station. Last week, with the first day of school approaching and no help apparent, Hodgdon and others tried to register the students themselves. They filled out registration forms with the families at the station, which they planned to deliver Monday. Two high school-age students from the police station were able to register at Hirsch Metropolitan High School, Goldstein said, though they were advised to use Google translate as the school wasn’t set up for English-learners. About those students, CPS said, “Hirsch has identified the students are in need of English Learner services and is working with the District’s Talent Office to ensure staff are at Hirsch to provide services to new students this week.” In the statement, CPS said it was “developing a plan to incorporate enrollment procedures for those families who are staying at police stations.” The statement continued: “We are working with urgency and are dedicated to enrolling as many families as quickly as we can. This includes deploying mobile units to local police stations and other temporary shelters this week to ensure all children are provided access to our services.” Some say those plans should already be ready. “This is not a surprise,” Hodgdon said of the families trying to enroll. “Children have been in stations since March.” Another pair of immigrants staying at a West Side police station said they also had trouble enrolling, said volunteer Celine Woznica. Woznica said she brought two 16-year-olds from the Austin District police station to Austin High School last Friday and they were sent to the Roberto Clemente Welcoming Center. On Monday, they returned to the high school after an administrator at another CPS school told them the high school should accept them. Administrators at Austin directed them to a Belmont Cragin high school, where administrators told them to return to Austin. After the successive trips and three hours of moving between schools, Woznica said they finally managed to get the two students registered at Austin High School. “They just didn’t want to deal with migrant children,” Woznica said. Michael Loria is a staff reporter at the Chicago Sun-Times via Report for America, a not-for-profit journalism program that aims to bolster the paper’s coverage of communities on the South Side and West Side.
2023-10-16	20:17:21+00:00		France looking to deport immigrants with extremist ties after teacher killed by man shouting 'Allahu Akbar'	https://www.foxnews.com/world/france-looking-deport-pro-hamas-immigrants-following-murder-teacher	"Former Israeli ambassador to the U.S. Michael Oren speaks with ‘America Reports’ anchor John Roberts in Tel Aviv about the impact of the war in Israel. French President Emmanuel Macron is reportedly requesting a review of all foreign immigrants with ties to radical extremists for possible deportation after the murder of a French teacher by an Islamic terrorist. Three days after a teacher was murdered by a Chechen immigrant on France's extremist watchlist with a knife shouting ""Allahu Akbar!,"" the country has raised its anti-terrorism alert to the highest levels, according to a report in Euronews. As the Middle East reels from the war in Israel and Gaza following the Hamas terrorist attacks that killed over 1,400 Israelis, Macron ordered his administration to carry out a review to determine which foreigners with a record of radicalism can be expelled from the country, according to reports. According to the same report in Euronews, local authorities have 48 hours to examine in detail the files of ""radicalized people drawn up by the secret services"" to ensure that there are no ""oversights"" in their expulsion procedure. Schoolchildren leave the area after a man armed with a knife killed a teacher and wounded two others at a high school in northern France on Friday. Antiterror prosecutors said they were leading the investigation into the attack at the Gambetta High School in the city of Arras, some 115 miles north of Paris. (AP Photo/Michel Spingler) Macron said during a Friday news briefing that police stopped a second attempted attack after the fatal stabbing of the teacher, which he said shows ""the barbarism of Islamic terrorism."" The 20-year-old suspect was already on a terror watchlist, according to AFP, which cited a police source who said he shouted the Arabic phrase ""Allahu Akbar!"" during the attack. Macron wants the state to be ""implacable against all those who support hatred and terrorist ideologies,"" an adviser reportedly told French media. ISRAEL REPORTS KILLING TOP HAMAS COMMANDERS, 'ELIMINATING' OTHER KEY TERROR OPERATIVES IN GAZA AIRSTRIKES A salvo of rockets is fired by Palestinian terrorists from Gaza as an Israeli missile launched from the Iron Dome defense missile system attempts to intercept the rockets, fired from the Gaza Strip, over the city of Netivot in southern Israel on Oct. 8, 2023. (MAHMUD HAMS/AFP via Getty Images) French Interior Minister Gerald Darmanin has reportedly also instructed authorities to pay particular attention to young people from the Caucasus. The government has said it is not trying to stigmatize any community, but both the attacker who killed the teacher Friday and the murderer of Samuel Paty — a teacher beheaded by an Islamist three years ago — were from that region. Darmanin has indicated that he will resume talks with Russia to organize these expulsions, which have been interrupted by the war in Ukraine, according to the local report. ""There are about 60 dossiers of Russian citizens. Among them are people from Chechnya. The instruction we had until now was to systematically expel these people who could be particularly dangerous,"" the interior minister told the press. PUTIN, ISRAEL'S NETANYAHU TO HOLD CALL OVER HAMAS WAR AHEAD OF RUSSIAN PRESIDENT'S TRIP TO CHINA French Interior Minister Gerald Darmanin, left, stands next to French President Emmanuel Macron as he talks to the press after a visit to the Gambetta High School in Arras, northeastern France, on Friday, after a teacher was killed and two other people severely wounded in a knife attack. (Ludovic Marin / POOL / AFP via Getty Images) The announcement follows reports of French police using teargas to break up a banned pro-Hamas rally in Paris on Thursday, as Macron urged the French to refrain from bringing the Israel-Hamas conflict to their borders. ""This event is an earthquake for Israel, the Middle East and beyond,"" Macron said, according to a Reuters report. ""Let's not pursue at home ideological adventures by imitating or projecting."" CLICK HERE TO GET THE FOX NEWS APP ""Let's not add, through illusions or calculations, domestic divides to international divides,"" the French president continued. ""The shield of unity will protect us from hatred and excesses."" Fox News Digital's Michael Ruiz and Reuters contributed to this report. Brianna Herlihy is a politics writer for Fox News Digital."
2023-09-21	18:59:52+00:00	Associated Press | ap@dfmdev.com	After a lull, asylum-seekers adapt to US immigration changes and again overwhelm border agents	https://www.whittierdailynews.com/2023/09/21/after-a-lull-asylum-seekers-adapt-to-us-immigration-changes-and-again-overwhelm-border-agents/	JACUMBA HOT SPRINGS, Calif. — A group of migrants from China surrendered to a Border Patrol agent in remote Southern California as gusts of wind drowned the hum of high-voltage power lines, joining others from Ecuador, Brazil, Colombia and elsewhere in a desert campsite with shelters made from tree branches. Their arrival Wednesday was another sign that agents have become overwhelmed in recent days by asylum-seekers on parts of the U.S. border with Mexico. In tiny Eagle Pass, Texas, nearly 6,000 migrants crossed from Mexico in to the U.S. in two days, prompting authorities to close one of the town’s two official border crossings so those agents could instead help with the influx. Border crossings have closed recently for similar reasons in San Diego and El Paso, Texas. After a dip in illegal crossings that followed new asylum restrictions in May, President Joe Biden’s administration is again on its heels. Democratic mayors and governors are seeking more relief for hosting asylum-seekers and Republicans are seizing on the issue ahead of 2024 elections. The Homeland Security Department said Wednesday it would grant Temporary Protected Status to an estimated 472,000 Venezuelans who were in the U.S. on July 31, easing paths to work authorization. That’s in addition to 242,700 Venezuelans who already had qualified for temporary status. The administration is also sending 800 active-duty military troops to the border, adding to 2,500 National Guard members there. It’s expanding border holding facilities by 3,250 people to nearly 23,000, and extending home surveillance nationwide for families awaiting initial asylum screenings. The administration renewed pressure — and blame — on Congress, which has long failed to agree on changes to the nation’s immigration system. The Biden administration is now asking Congress for $4 billion in emergency funding. “As a result of Congress’ failure to enact the reform, the Administration has been using the limited tools it has available to secure the border and build a safe, orderly, and humane immigration system while leading the largest expansion of lawful pathways for immigration in decades,” the Homeland Security Department said in a statement, “ Theresa Cardinal Brown, the Bipartisan Policy Center’s senior advisor for immigration and border policy, said it’s normal to see a dip in illegal crossings after major changes, like those imposed in May, but those are usually short-lived. Once families see some migrants are able to stay in the U.S, they decide to try their luck. “People see what happened to the last group of people that tried and they’re like, ‘Oh, well maybe it’s not as harsh as they say,’” Brown said. An increase in families arriving at the border led to unacceptable conditions in two of the busiest Border Patrol sector, a court-appointed monitor reported to a federal court last week. Dr. Paul H. Wise said children as young as 8 years old were separated from parents during processing in South Texas, a practice that has been mainly used for boys 13 to 17. U.S. Customs and Border Protection said it was reviewing Wise’s report, noting limited, temporary separations may occur during processing for safety reasons but they are nothing like the long-term separations under former President Donald Trump. Wise said even short-term separation can have “lasting, harmful effects.” In Eagle Pass, a town of 28,000 people, about 2,700 migrants crossed Tuesday and 3,000 Wednesday, according to Maverick County Sheriff Tom Schmerber. Mayor Rolando Salinas declared the city a disaster area on Tuesday. U.S. authorities closed a bridge and international railway in Eagle Pass on Wednesday to redirect staff. Union Pacific Railroad Co. said the closure halted hundreds of thousands of tons of cargo. In San Diego, a pedestrian crossing has been closed since Sept. 14 to direct staff to an area where migrants from Cameroon to Colombia are waiting between a double-layer border wall in San Diego. Volunteers are handing the migrants food and bottled water while they wait to be processed. Near Jacumba Hot Springs, a town of less than 1,000 people with a small hotel and general store amid boulder-strewn mountains an hour’s drive east of San Diego, migrants camps began forming last week for the first time since May. Smugglers drive migrants to a spot in Mexico where the border wall ends. One of three camps in the Jacumba Valley is about a half-hour walk on a gravel road used almost exclusively by border agents. On Wednesday, none had stayed longer than one night, occupying tents that were left behind by others. The Border Patrol gives migrants colored wristbands marking their arrival date to determine who gets shuttled first to a processing location. Campfires and juniper shrub shield migrants from evening chills. Angel Sisa, 40, left Ecuador’s coastal region with his wife and two children, ages 15 and 13, selling his general store to escape death threats from criminals demanding monthly payments. The Sisa family paid smugglers to take them by plane and bus until they reached a hotel in Tecate, the nearest town in Mexico from the roadside drop where they crossed. They hope to settle in Minneapolis with family members who left Ecuador about a year ago. Carlos Andres Vasquez, 37, flew from his home country of Colombia to Mexico City as a tourist and paid a smuggler $800 to be driven from Tijuana on a road filled with bumps and potholes before arriving near where they would cross into the U.S. “They treated like cattle, like animals,” Vasquez said. “They put 20, 18 of us in a van, women and children in front and we went in back.” He said he and other South Americans walked to the campsite Tuesday under a “very pleasant” Border Patrol agent’s watch. Vasquez, whose father was killed and who left Colombia because of death threats, plans to settle with a friend in Holyoke, Massachusetts, and save money for his wife and children, ages 7 and 2, to join him. Associated Press writers Valerie Gonzalez in McAllen, Texas, Colleen Long in Washington and Josh Funk in Omaha, Nebraska, contributed.
2023-10-10	20:02:39+00:00	Arit John,Alison Main	Trump again uses terror abroad to make case for hard-line immigration policies	https://www.cnn.com/2023/10/10/politics/trump-israel-terror-immigration-policy/index.html	 In the wake of Hamas’ deadly attacks on Israel, former President Donald Trump is turning to a strategy he employed during the 2016 campaign of using terror abroad – and fears of future attacks on American soil – to push for hard-line immigration policies in the United States. During a Monday rally in Wolfeboro, New Hampshire, Trump renewed his pledge to reinstate his controversial travel ban that targeted predominantly Muslim countries as he sought to link the ongoing conflict in Israel and Gaza with US border security. He also asserted, without evidence, that the “same people” perpetrating violent attacks in Israel were entering the US through “our totally open southern border,” before speculating that some people crossing the border may be planning an “attack” on the US. The former president’s rhetoric harks back to his 2016 presidential campaign and his first term in office, when he used fears over terror attacks stateside to block immigrants and refugees from predominantly Muslim countries. During the 2016 cycle, Trump’s campaign called for a “total and complete shutdown of Muslims entering the United States” in the wake of the December 2015 mass shooting in San Bernardino, California, by suspected ISIS sympathizers. He also condemned the Obama administration’s approach to combating ISIS after then-President Barack Obama declared that the terrorist organization had been “contained” one day before the group claimed responsibility for a series of deadly coordinated attacks throughout Paris in November 2015. “We have leadership who doesn’t know what they’re doing,” Trump said after those attacks. Within days of taking office in January 2017, Trump signed an executive order for the initial travel ban, which blocked citizens of seven predominantly Muslim countries – Iraq, Iran, Libya, Somalia, Sudan, Syria and Yemen – from entering the country for 90 days. The ban sparked protests at airports across the country and drew several legal challenges. The Supreme Court upheld the third iteration of the ban in 2018. President Joe Biden revoked the travel ban after he took office in 2021. Since launching his 2024 presidential campaign, Trump has vowed to bring the ban back if elected and to expand it to include “communists and Marxists.” Trump argued Monday that such a ban would prevent attacks similar to the ones launched in Israel over the weekend by the Palestinian militant group Hamas from happening in the US. Trump is not the first Republican candidate to link terrorism fears and border security. Republicans raised fears of ISIS terrorists crossing into the US from the southern border during the 2014 midterm elections. Ahead of the 2018 midterms, Trump asserted, without evidence, that migrant caravans heading to the US from Central America had “unknown Middle Easterners” mixed in with the groups. This election cycle, GOP candidates have been focused on a different threat: fentanyl. Some Republican presidential hopefuls have said they would use military force to combat drug trafficking at the border and vowed to address China’s role in producing the chemicals that cartels use to manufacture the drug. But a few candidates have joined Trump in drawing parallels between the attacks in Israel and safety in the US. Florida Gov. Ron DeSantis said Monday that people who intend to harm Americans might cross the southern border. “You have to recognize that if that can happen in Israel, what do you think can happen in our country with an open border where 7 million people at a minimum have come through illegally?” he said at a campaign stop in Pocahontas, Iowa. Biotech entrepreneur Vivek Ramaswamy has also sought to tie Israel’s war with Hamas to US-Mexico border policy. “What we read about in the papers is how could this have happened with the intelligence failures and the security that Israel has on its own borders,” Ramaswamy said Sunday in Manchester, New Hampshire. “And those are important questions that are yet to be answered and will hopefully be answered in the coming weeks. But the No. 1 self-reflection of this country is that if it can happen over there, it can certainly happen over here in this country.” In a social media post Tuesday, Ramaswamy wrote that America “should use the attacks on Israel as a wake-up call” and said he plans to visit the US-Mexico border on Friday. Most of the Republican presidential candidates have focused their response to the Hamas attacks on hammering the Biden administration for the recent prisoner release deal with Iran, which included the transfer of $6 billion in Iranian frozen funds. Trump asserted Monday that the deal had caused the current violence in Israel, in addition to money Iran has made in oil sales and “our country’s perceived weakness with an incompetent and corrupt leader.” Former South Carolina Gov. Nikki Haley said it was “irresponsible” for US Secretary of State Antony Blinken to not link the Hamas attack to the prisoner release deal. South Carolina Sen. Tim Scott accused the Biden administration of being “complicit” in the attack and called on Treasury Secretary Janet Yellen to testify on the $6 billion transfer before the Senate Banking Committee, on which he is the top Republican. And DeSantis announced Tuesday that he is planning to roll out legislation during Florida’s upcoming legislative session to increase sanctions on Iran and block Iranian business in the state. The Biden administration has said that funds from the prisoner release deal went directly to Qatar, and Iran can only access the funds for humanitarian purposes. This story has been updated with additional reporting. 
